{
  "generated_at": "2026-08-06T08:27:54Z",
  "records": [
    {
      "classification": "historical-evidence-pass",
      "evidence_path": "logs/original/TC-001.log",
      "evidence_sha256": "223bf7d013013c307db54a551f045748df3cb7af91ca994c6feca944f9bf2ab8",
      "evidence_status": "available-original",
      "final_disposition": "accepted-historical-pass",
      "final_evidence_path": "docs/Accelerator-TestEvidence-Submission/logs/original/TC-001.log",
      "framework": "Laravel",
      "historical_result": "Pass",
      "identity": "RUN-001|TC-001|NONE",
      "namespaced_defect_id": null,
      "native_client_requirement": "claude-code",
      "original_defect_id": null,
      "owner": "Accelerator Team",
      "provenance": {
        "conflicts": [],
        "sources": [
          "manifests/historical-runs.json"
        ]
      },
      "remediation_workstream": "historical-evidence-acceptance",
      "required_regressions": [],
      "review_status": "approved",
      "run_id": "RUN-001",
      "source_evidence_status": "package-verified",
      "source_group": "historical-57",
      "test_case_id": "TC-001",
      "tested_commit": "3a02537",
      "tool": "Claude Code"
    },
    {
      "classification": "historical-evidence-pass",
      "evidence_path": "logs/original/TC-002.log",
      "evidence_sha256": "adcec68a082b39f06508a00b7a1b4135ffb7c20789f28816e3db11bfe2bc1c4a",
      "evidence_status": "available-original",
      "final_disposition": "accepted-historical-pass",
      "final_evidence_path": "docs/Accelerator-TestEvidence-Submission/logs/original/TC-002.log",
      "framework": "Symfony",
      "historical_result": "Pass",
      "identity": "RUN-002|TC-002|NONE",
      "namespaced_defect_id": null,
      "native_client_requirement": "claude-code",
      "original_defect_id": null,
      "owner": "Accelerator Team",
      "provenance": {
        "conflicts": [],
        "sources": [
          "manifests/historical-runs.json"
        ]
      },
      "remediation_workstream": "historical-evidence-acceptance",
      "required_regressions": [],
      "review_status": "approved",
      "run_id": "RUN-002",
      "source_evidence_status": "package-verified",
      "source_group": "historical-57",
      "test_case_id": "TC-002",
      "tested_commit": "3a02537",
      "tool": "Claude Code"
    },
    {
      "classification": "historical-evidence-pass",
      "evidence_path": "logs/original/TC-003.log",
      "evidence_sha256": "6bc395d78e68d45705ae896255f113930252805006b1522399db5a536150eb93",
      "evidence_status": "available-original",
      "final_disposition": "accepted-historical-pass",
      "final_evidence_path": "docs/Accelerator-TestEvidence-Submission/logs/original/TC-003.log",
      "framework": "PHP Core",
      "historical_result": "Pass",
      "identity": "RUN-003|TC-003|NONE",
      "namespaced_defect_id": null,
      "native_client_requirement": "claude-code",
      "original_defect_id": null,
      "owner": "Accelerator Team",
      "provenance": {
        "conflicts": [],
        "sources": [
          "manifests/historical-runs.json"
        ]
      },
      "remediation_workstream": "historical-evidence-acceptance",
      "required_regressions": [],
      "review_status": "approved",
      "run_id": "RUN-003",
      "source_evidence_status": "package-verified",
      "source_group": "historical-57",
      "test_case_id": "TC-003",
      "tested_commit": "3a02537",
      "tool": "Claude Code"
    },
    {
      "classification": null,
      "evidence_path": "logs/original/TC-004.log",
      "evidence_sha256": "7f27bffef458c5a59b5055497de6f73dd15a90c924e25c0b3f80436276937c80",
      "evidence_status": "available-original",
      "final_disposition": null,
      "final_evidence_path": null,
      "framework": "Laravel",
      "historical_result": "Partial",
      "identity": "RUN-004|TC-004|DEF-001",
      "namespaced_defect_id": "DEF-001",
      "native_client_requirement": "cursor",
      "original_defect_id": "DEF-001",
      "owner": "Accelerator Team",
      "provenance": {
        "conflicts": [],
        "sources": [
          "manifests/historical-runs.json"
        ]
      },
      "remediation_workstream": null,
      "required_regressions": [],
      "review_status": "pending",
      "run_id": "RUN-004",
      "source_evidence_status": "package-verified",
      "source_group": "historical-57",
      "test_case_id": "TC-004",
      "tested_commit": "3a02537",
      "tool": "Cursor"
    },
    {
      "classification": "historical-evidence-pass",
      "evidence_path": "logs/original/TC-005.log",
      "evidence_sha256": "2096be5f9b34ed14119821c1a5f3c61f03f8102adf6dbe655840c2678af2537c",
      "evidence_status": "available-original",
      "final_disposition": "accepted-historical-pass",
      "final_evidence_path": "docs/Accelerator-TestEvidence-Submission/logs/original/TC-005.log",
      "framework": "Laravel",
      "historical_result": "Pass",
      "identity": "RUN-005|TC-005|NONE",
      "namespaced_defect_id": null,
      "native_client_requirement": "codex",
      "original_defect_id": null,
      "owner": "Accelerator Team",
      "provenance": {
        "conflicts": [],
        "sources": [
          "manifests/historical-runs.json"
        ]
      },
      "remediation_workstream": "historical-evidence-acceptance",
      "required_regressions": [],
      "review_status": "approved",
      "run_id": "RUN-005",
      "source_evidence_status": "package-verified",
      "source_group": "historical-57",
      "test_case_id": "TC-005",
      "tested_commit": "3a02537",
      "tool": "Codex"
    },
    {
      "classification": null,
      "evidence_path": "logs/original/TC-007.log",
      "evidence_sha256": "d7a81f1e39ff3234a35384d1c0c907c5edc4480d2e7fdcd80fe9e962de496996",
      "evidence_status": "available-original",
      "final_disposition": null,
      "final_evidence_path": null,
      "framework": "Infrastructure-Creator",
      "historical_result": "Partial",
      "identity": "RUN-006|TC-007|NONE",
      "namespaced_defect_id": null,
      "native_client_requirement": "claude-code",
      "original_defect_id": null,
      "owner": "Accelerator Team",
      "provenance": {
        "conflicts": [],
        "sources": [
          "manifests/historical-runs.json"
        ]
      },
      "remediation_workstream": null,
      "required_regressions": [],
      "review_status": "pending",
      "run_id": "RUN-006",
      "source_evidence_status": "package-verified",
      "source_group": "historical-57",
      "test_case_id": "TC-007",
      "tested_commit": "3a02537",
      "tool": "Claude Code"
    },
    {
      "classification": null,
      "evidence_path": "logs/original/TC-008.log",
      "evidence_sha256": "3afa2d11cf40c84f1b8c0127ddbbdeddbec2e96239c77b1273321276094bea2f",
      "evidence_status": "available-original",
      "final_disposition": null,
      "final_evidence_path": null,
      "framework": "Infrastructure-Creator",
      "historical_result": "Partial",
      "identity": "RUN-007|TC-008|DEF-002",
      "namespaced_defect_id": "DEF-002",
      "native_client_requirement": "claude-code",
      "original_defect_id": "DEF-002",
      "owner": "Accelerator Team",
      "provenance": {
        "conflicts": [],
        "sources": [
          "manifests/historical-runs.json"
        ]
      },
      "remediation_workstream": null,
      "required_regressions": [],
      "review_status": "pending",
      "run_id": "RUN-007",
      "source_evidence_status": "package-verified",
      "source_group": "historical-57",
      "test_case_id": "TC-008",
      "tested_commit": "3a02537",
      "tool": "Claude Code"
    },
    {
      "classification": null,
      "evidence_path": "logs/original/TC-014.log",
      "evidence_sha256": "738808a646cb60614b23e4e4a6f97969d554daff101c0eff6fd4d84f79901b94",
      "evidence_status": "available-original",
      "final_disposition": null,
      "final_evidence_path": null,
      "framework": "Infrastructure-Creator",
      "historical_result": "Partial",
      "identity": "RUN-008|TC-014|DEF-003",
      "namespaced_defect_id": "DEF-003",
      "native_client_requirement": "claude-code",
      "original_defect_id": "DEF-003",
      "owner": "Accelerator Team",
      "provenance": {
        "conflicts": [],
        "sources": [
          "manifests/historical-runs.json"
        ]
      },
      "remediation_workstream": null,
      "required_regressions": [],
      "review_status": "pending",
      "run_id": "RUN-008",
      "source_evidence_status": "package-verified",
      "source_group": "historical-57",
      "test_case_id": "TC-014",
      "tested_commit": "3a02537",
      "tool": "Claude Code"
    },
    {
      "classification": null,
      "evidence_path": "logs/original/TC-015.log",
      "evidence_sha256": "d76e53aacd12a0f1b5ad548abcf0afb4c182e8b16b44dca9dc993333131cdb78",
      "evidence_status": "available-original",
      "final_disposition": null,
      "final_evidence_path": null,
      "framework": "Infrastructure-Creator",
      "historical_result": "Partial",
      "identity": "RUN-009|TC-015|NONE",
      "namespaced_defect_id": null,
      "native_client_requirement": "claude-code",
      "original_defect_id": null,
      "owner": "Accelerator Team",
      "provenance": {
        "conflicts": [],
        "sources": [
          "manifests/historical-runs.json"
        ]
      },
      "remediation_workstream": null,
      "required_regressions": [],
      "review_status": "pending",
      "run_id": "RUN-009",
      "source_evidence_status": "package-verified",
      "source_group": "historical-57",
      "test_case_id": "TC-015",
      "tested_commit": "3a02537",
      "tool": "Claude Code"
    },
    {
      "classification": null,
      "evidence_path": "logs/original/TC-016.log",
      "evidence_sha256": "9da4c4e2fdbcc4464322fb2f054a5e5fdb98dd66dbd1863c22104cac394c9048",